{
  "title": "Build tier list",
  "intro_one": "Compare {{count}} supported upstream level-60 DPS preset with its complete recorded setup.",
  "intro_other": "Compare {{count}} supported upstream level-60 DPS presets with their complete recorded setups.",
  "arenaNavigation": "Simulator and arenas",
  "back": "Back to the simulator",
  "raceArena": "Race tier list",
  "limitationsTitle": "Live-game presets, with data limitations",
  "limitations": "These upstream presets have unequal gear levels and replacement items that have not been gear-optimized. The live wowf 1.60.1.70658 hotfix cache omits some items from the simulator database; absence from the cache does not establish unavailability in game. Some vanilla-ID replacements do not activate the registered Forever set bonuses. Rankings measure personal single-target DPS, including pets, for these exact setups; they do not establish absolute class balance.",
  "raidSupport": "Every build receives full raid, party and individual buffs and target debuffs, including support it cannot supply itself. Utility, survival, movement and the value of providing raid support are outside this comparison.",
  "controls": "Comparison settings",
  "duration": "Fight length",
  "seconds_one": "{{count}} second",
  "seconds_other": "{{count}} seconds",
  "target": "Target type",
  "targets": {
    "Mechanical": "Neutral (Mechanical)",
    "Elemental": "Elemental",
    "Beast": "Beast"
  },
  "comparison": "Compare builds",
  "allBuilds": "All classes",
  "raceMode": "Race selection",
  "bestRace": "Best legal race per build",
  "bestRaceHelp": "Each build uses its highest estimated race for this fight. Close race estimates can be indistinguishable at this precision. Inspect a build to see every legal race.",
  "fixedRaceHelp": "Only builds with this legal class and race combination appear. Other builds are excluded from the comparison.",
  "search": "Find a build",
  "searchPlaceholder": "Search build, class, gear or rotation",
  "rankings": "Build rankings",
  "encounterTitle": "{{seconds}} seconds · {{target}}",
  "reference_one": "Reference: {{name}} ({{race}}), {{dps}} DPS. Showing {{count}} of {{total}} builds. Search leaves this reference unchanged.",
  "reference_other": "Reference: {{name}} ({{race}}), {{dps}} DPS. Showing {{count}} of {{total}} builds. Search leaves this reference unchanged.",
  "omitted_one": "{{count}} build has no legal {{race}} result for this encounter and is excluded:",
  "omitted_other": "{{count}} builds have no legal {{race}} result for this encounter and are excluded:",
  "tierLegend": "Tier thresholds",
  "tierFirst": "0–{{upper}}% behind",
  "tierRange": "over {{lower}}–{{upper}}% behind",
  "tierLast": "over {{lower}}% behind",
  "estimateHelp": "DPS ± the approximate marginal 95% Monte Carlo interval (1.96 standard errors). Spread is the gap from a build's lowest to highest race estimate in this fight.",
  "tier": "Tier",
  "build": "Build / gear",
  "dps": "DPS ± 95%",
  "gap": "Behind reference",
  "race": "Race",
  "spread": "Race spread",
  "details": "Details",
  "inspect": "Inspect",
  "inspectBuild": "Inspect {{name}}",
  "developmentGear": "Development gear",
  "status": "Preset status: {{status}}",
  "indistinguishable": "Indistinguishable from reference at this precision",
  "boundary": "Tier boundary uncertain",
  "boundaryHelp": "Approximate 95% gap interval: {{low}}% to {{high}}%. It crosses a tier boundary.",
  "closeRaces_one": "{{count}} race within simulation precision",
  "closeRaces_other": "{{count}} races within simulation precision",
  "noSearch": "No builds match your search. Clear it to show the comparison again.",
  "noResults": "No recorded builds match this race and encounter. Choose another race or comparison.",
  "method": "Method and recorded sources",
  "methodFight": "Fixed-length fights against one level {{level}} target with {{armor}} armor. Each race and encounter has {{iterations}} iterations with seed 101. Each preset keeps its recorded gear, talents, rotation, class and pet options, consumables, weapon swaps and support across races.",
  "methodNoise": "Close results use an independent approximation: the difference's standard error is the square root of the sum of squared standard errors. A shared seed alone does not establish a paired comparison. These marginal intervals describe simulation sampling noise; they do not cover uncertain game mechanics or establish simultaneous confidence across all comparisons.",
  "methodSelection": "Selecting the highest observed race can bias that estimate upward. The displayed race is an estimate for this encounter, not proof of a unique optimum. Gear and rotations are not optimized separately for each race.",
  "methodTiers": "Gaps round to two decimal places before tier assignment. Boundary warnings use an approximate delta-method interval for the DPS ratio to the reference, with independent errors and a fixed selected reference. Search only hides rows; class and race choices change the reference population.",
  "published": "Published {{date}}.",
  "upstream": "Upstream presets {{commit}}",
  "verified": "Compatibility checked {{commit}}",
  "dateUnrecorded": "computation date unrecorded",
  "reusedSource": "{{id}}: reused results; {{date}}.",
  "computedSource": "{{id}}: computed {{date}}.",
  "sourcePublished": "Source published {{date}}.",
  "excluded": "Outside this comparison",
  "gearTalents": "Gear, talents and swaps",
  "downloadRace": "Race for saved request",
  "downloadRequest": "Download Go RaidSimRequest",
  "requestHelp": "Complete Go RaidSimRequest for {{race}}, {{seconds}} seconds, {{target}}. This file is for the Go runner, not the simulator UI import. Only race, duration and target creature type change from the recorded request.",
  "raceResults": "All legal races in this encounter",
  "raceResultsHelp": "Races sort by estimated DPS. Estimates within the approximate 95% independent difference interval of the highest race are indistinguishable at this precision.",
  "raceGap": "Behind highest race",
  "precision": "Comparison precision",
  "indistinguishableRace": "Indistinguishable at this precision",
  "lowerEstimate": "Lower estimate",
  "settings": "Recorded class, pet, consumable and support settings",
  "settingsHelp": "These are the saved request values. Nested headings follow the recorded settings; omitted fields use the Go message defaults. The download contains every field, including the rotation and database.",
  "recordedRotation": "Recorded rotation actions and conditions",
  "rowProvenance": "Source {{source}} · {{iterations}} iterations · {{date}}",
  "setupTitle": "{{name}}: recorded gear and talents",
  "none": "None",
  "yes": "Yes",
  "no": "No",
  "unknownItem": "Unknown item (ID {{id}})",
  "unknownSpell": "Unknown spell (ID {{id}})",
  "fields": {
    "offensivePotId": "Offensive potion",
    "action": "Action",
    "petType": "Pet",
    "ohWeaponImbueId": "Off-hand class imbue",
    "potions": "Available potions",
    "flaskId": "Flask",
    "classOptions": "Class options",
    "conjuredId": "Conjured item",
    "prepullActions": "Before the pull",
    "swapMhWeaponImbueId": "Swap main-hand class imbue",
    "spellId": "Spell",
    "swapOhImbueId": "Swap off-hand oil or stone",
    "targetDebuffs": "Target debuffs",
    "mhImbueId": "Main-hand oil or stone",
    "swapOhWeaponImbueId": "Swap off-hand class imbue",
    "explosiveId": "Explosive",
    "partyBuffs": "Party buffs",
    "itemId": "Item",
    "raidBuffs": "Raid buffs",
    "foodId": "Food",
    "priorityList": "Rotation priority",
    "defensivePotId": "Defensive potion",
    "conjuredItems": "Conjured items",
    "mhWeaponImbueId": "Main-hand class imbue",
    "auraId": "Aura",
    "swapMhImbueId": "Swap main-hand oil or stone",
    "buffId": "Buff",
    "buffs": "Individual buffs",
    "consumes": "Consumables",
    "options": "Class options",
    "extraIds": "Other consumables",
    "castSpell": "Cast spell",
    "resourcePotId": "Resource potion",
    "elixirIds": "Elixirs",
    "ohImbueId": "Off-hand oil or stone",
    "condition": "Condition",
    "consumables": "Consumables",
    "summon": "Summoned pet",
    "petUptime": "Pet uptime (fraction of fight)",
    "reactionTimeMs": "Reaction time (milliseconds)",
    "distanceFromTarget": "Distance from target (yards)",
    "profession1": "First profession",
    "profession2": "Second profession"
  },
  "computedWindow": "{{start}} to {{end}}",
  "compatibilityEvidence": "Compatibility evidence",
  "recordedLabel": "Recorded preset label: {{name}}"
}
